{
  "schema_version": "0.1.0",
  "record_type": "act",
  "act_id": "ng-federal-act-2023-37",
  "jurisdiction": "ng-federal",
  "country_code": "NG",
  "titles": {
    "official": "Nigeria Data Protection Act, 2023",
    "short": "Nigeria Data Protection Act",
    "long": "An Act to provide a legal framework for the protection of personal information, and establish the Nigeria Data Protection Commission for the regulation of the processing of personal information; and for related matters."
  },
  "year": 2023,
  "number": "37",
  "citation": "Act No. 37 of 2023",
  "dates": {
    "assent": {
      "date": "2023-06-12",
      "null_reason": null,
      "source_ids": [
        "sha256:5bfb22cf7b344e92ecca9b80decf73db694a0d1000c4f42188f46e047d8df075"
      ]
    },
    "publication": {
      "date": "2023-07-01",
      "null_reason": null,
      "source_ids": [
        "sha256:5bfb22cf7b344e92ecca9b80decf73db694a0d1000c4f42188f46e047d8df075"
      ]
    },
    "commencement": {
      "date": "2023-06-12",
      "null_reason": null,
      "source_ids": [
        "sha256:5bfb22cf7b344e92ecca9b80decf73db694a0d1000c4f42188f46e047d8df075"
      ]
    },
    "repeal": {
      "date": null,
      "null_reason": "not_researched",
      "source_ids": []
    }
  },
  "aliases": [
    "NDPA 2023",
    "Nigeria Data Protection Act"
  ],
  "status": "unknown",
  "checked_through_date": null,
  "status_source_ids": [],
  "source_refs": [
    {
      "source_id": "sha256:5bfb22cf7b344e92ecca9b80decf73db694a0d1000c4f42188f46e047d8df075",
      "role": "authoritative_text",
      "scope_note": "Complete as-enacted text in the official gazette."
    }
  ],
  "editorial_notes": []
}
